<?xml version="1.0" encoding="UTF-8"?>
<xsd:schema xmlns:xsd="http://www.w3.org/2001/XMLSchema">
	<xsd:element name="equipmentList">
		<xsd:complexType>
			<xsd:sequence>
				<xsd:element name="equipment" type="equipment" minOccurs="0"
					maxOccurs="unbounded" />
			</xsd:sequence>
		</xsd:complexType>
	</xsd:element>

	<xsd:complexType name="equipment">
		<xsd:attribute name="name" type="xsd:string" use="required"/>
		<xsd:attribute name="cost" type="xsd:float" use="optional"/>
		<xsd:attribute name="weight" type="xsd:float" use="optional"/>
		<xsd:attribute name="type" type="xsd:string" use="required"/>
		<xsd:attribute name="availability">
			<xsd:simpleType>
				<xsd:restriction base="xsd:string">
					<xsd:enumeration value="E" />
					<xsd:enumeration value="C" />
					<xsd:enumeration value="R" />
					<xsd:enumeration value="I" />
				</xsd:restriction>
			</xsd:simpleType>
		</xsd:attribute>
	</xsd:complexType>
	
</xsd:schema>